{
  "schema": "tezuri.import-manifest/v1",
  "importId": "import:synthetic-2026-08-13",
  "source": {
    "kind": "substack-feed-archive",
    "feedUrl": "https://example.test/feed",
    "archiveUrl": "https://example.test/archive",
    "discoveredAt": "2026-08-13T15:00:00Z"
  },
  "state": "succeeded",
  "startedAt": "2026-08-13T15:00:00Z",
  "completedAt": "2026-08-13T15:30:00Z",
  "summary": {
    "discovered": 1,
    "imported": 1,
    "skipped": 0,
    "failed": 0,
    "reviewRequired": 0
  },
  "articles": [
    {
      "source": {
        "id": "post-1",
        "url": "https://example.test/p/patina",
        "title": "Patina as memory",
        "publishedAt": "2024-04-05T12:00:00Z",
        "sourceDigest": "sha256:bbbbbbbbbbbbbbbbbbbbbbbbbbbbbbbbbbbbbbbbbbbbbbbbbbbbbbbbbbbbbbbb",
        "metadata": { "tags": ["architecture"] }
      },
      "disposition": "imported",
      "destinationPath": "src/writing/patina/index.md",
      "resultDigest": "sha256:cccccccccccccccccccccccccccccccccccccccccccccccccccccccccccccccc",
      "resultMetadata": { "status": "current", "tags": ["architecture"] },
      "transformations": [
        { "kind": "remove-subscription-chrome", "detail": "Removed platform subscription controls." }
      ],
      "warnings": [],
      "fidelity": [
        { "area": "body", "state": "preserved", "evidence": "Normalized body reviewed against the synthetic source." },
        { "area": "media", "state": "preserved", "evidence": "All displayed media is repository-owned." }
      ],
      "assets": [
        {
          "sourceUrl": "https://example.test/images/patina.png",
          "disposition": "imported",
          "destinationPath": "src/writing/patina/media/patina.png",
          "resultDigest": "sha256:aaaaaaaaaaaaaaaaaaaaaaaaaaaaaaaaaaaaaaaaaaaaaaaaaaaaaaaaaaaaaaaa",
          "transformations": [],
          "warnings": []
        }
      ]
    }
  ],
  "exclusions": []
}
